A1: 单位 | B1: 总人数 | C1: 年龄情况 | F1: 学历情况 | I1: 性别情况
C2: 35岁以下 | D2: 36-49岁 | E2: 50岁以上 | F2: 高中及其他 | G2: 大专以上 | H2: 研究生 | I2: 男 | J2: 女
A3: 渤海社区 | B3: 3 | D3: 1 | E3: 2 | F3: 2 | G3: 1 | I3: 1 | J3: 2
A4: 中革村 | B4: 7 | D4: 5 | E4: 2 | J4: 1
A5: 后革村 | B5: 7 | C5: 1 | D5: 5 | E5: 1 | G5: 7 | I5: 4 | J5: 3
A6: 夏家河村 | B6: 5 | C6: 1 | D6: 3 | E6: 1 | G6: 5 | I6: 4 | J6: 1
A7: 羊圈村 | B7: 7 | D7: 4 | E7: 3 | G7: 7 | I7: 6 | J7: 1
A8: 棋盘村 | B8: 5 | D8: 2 | E8: 3 | G8: 5 | I8: 3 | J8: 2
A9: 鞍子山村 | B9: 7 | D9: 3 | E9: 4 | G9: 7 | I9: 6 | J9: 1
A10: 合计 | B10: =SUM(B3:B9) -> 41 | C10: =SUM(C3:C9) -> 2 | D10: =SUM(D3:D9) -> 23 | E10: =SUM(E3:E9) -> 16 | F10: =SUM(F3:F9) -> 2 | G10: =SUM(G3:G9) -> 32 | H10: =SUM(H3:H9) -> 0 | I10: =SUM(I3:I9) -> 24 | J10: =SUM(J3:J9) -> 11