A1: 学校 | B1: 在编数 | C1: 校级干部 | D1: 中层干部 | E1: 专任教师数 | F1: 骨干教师数 | J1: 教师学历情况 | M1: 班级数 | N1: 学生数 | O1: 病休 | P1: 退休 | Q1: 暂离岗 | R1: 保安数 | S1: 备注
F2: 国家 | G2: 省 | H2: 市 | I2: 区 | J2: 研究生以上 | K2: 本科 | L2: 专科及以下
A3: 66中 | B3: 85 | C3: 3 | D3: 5 | E3: 78 | H3: 5 | I3: 7 | J3: 13 | K3: 69 | L3: 2 | M3: 24 | N3: 1094 | Q3: 1 | R3: 2
A4: 中心校 | B4: 59 | C4: 3 | D4: 6 | E4: 54 | H4: 5 | I4: 3 | J4: 4 | K4: 55 | L4: 0 | M4: 24 | N4: 1026 | O4: 1 | P4: 1 | R4: 2
A5: 后革 | B5: 43 | C5: 1 | D5: 4 | E5: 40 | H5: 3 | I5: 3 | J5: 3 | K5: 33 | L5: 7 | M5: 19 | N5: 711 | O5: 2 | R5: 2
A6: 棋盘 | B6: 19 | C6: 1 | D6: 2 | E6: 18 | H6: 1 | I6: 2 | J6: 1 | K6: 18 | M6: 7 | N6: 210 | O6: 产休1 | R6: 2
A7: 夏家河 | B7: 17 | C7: 1 | D7: 2 | E7: 17 | H7: 1 | K7: 16 | L7: 1 | M7: 6 | N7: 207 | R7: 2
A8: 小学小计 | B8: =SUM(B4:B7) -> 138 | C8: =SUM(C4:C7) -> 6 | D8: =SUM(D4:D7) -> 14 | E8: =SUM(E4:E7) -> 129 | F8: =SUM(F4:F7) -> 0 | G8: =SUM(G4:G7) -> 0 | H8: =SUM(H4:H7) -> 10 | I8: =SUM(I4:I7) -> 8 | J8: =SUM(J4:J7) -> 8 | K8: =SUM(K4:K7) -> 122 | L8: =SUM(L4:L7) -> 8 | M8: =SUM(M4:M7) -> 56 | N8: =SUM(N4:N7) -> 2154 | O8: =SUM(O4:O7) -> 3 | P8: =SUM(P4:P7) -> 1 | Q8: =SUM(Q4:Q7) -> 0 | R8: =SUM(R4:R7) -> 8
A9: 合计 | B9: =B3+B8 -> 223 | C9: =C3+C8 -> 9 | D9: =D3+D8 -> 19 | E9: =E3+E8 -> 207 | F9: =F3+F8 -> 0 | G9: =G3+G8 -> 0 | H9: =H3+H8 -> 15 | I9: =I3+I8 -> 15 | J9: =J3+J8 -> 21 | K9: =K3+K8 -> 191 | L9: =L3+L8 -> 10 | M9: =M3+M8 -> 80 | N9: =N3+N8 -> 3248 | O9: =O3+O8 -> 3 | P9: =P3+P8 -> 1 | Q9: =Q3+Q8 -> 1 | R9: =R3+R8 -> 10