A1: 单位 | B1: 年末总人口数（人） | C1: 革镇堡街道60岁及以上老年人口数（人）
C2: 60岁以上老年人口数 | G2: 65岁以上老年人口数 | K2: 70岁以上老年人口数 | O2: 80岁以上老年人口数 | S2: 90岁以上老年人口数 | W2: 100岁以上老年人口数
C3: 合计 | D3: 男 | E3: 女 | F3: 占户籍人口比例 | G3: 合计 | H3: 男 | I3: 女 | J3: 占户籍人口比例 | K3: 合计 | L3: 男 | M3: 女 | N3: 占户籍人口比例 | O3: 合计 | P3: 男 | Q3: 女 | R3: 占户籍人口比例 | S3: 合计 | T3: 男 | U3: 女 | V3: 占户籍人口比例 | W3: 合计 | X3: 男 | Y3: 女
A4: 中革 | B4: 4120 | C4: =SUM(D4:E4) -> 1277 | D4: 602 | E4: 675 | F4: =C4/B4 -> 0.30995145631068 | G4: =H4+I4 -> 854 | H4: 406 | I4: 448 | J4: =G4/B4 -> 0.20728155339805801 | K4: 489 | L4: 227 | M4: 262 | N4: =K4/B4 -> 0.11868932038835001 | O4: 122 | P4: 63 | Q4: 59 | R4: =O4/B4 -> 2.9611650485436899e-002 | S4: 12 | T4: 4 | U4: 8 | V4: =S4/B4 -> 2.9126213592233002e-003 | W4: =SUM(X4:Y4) -> 1 | Y4: 1
A5: 后革 | B5: 2963 | C5: =SUM(D5:E5) -> 900 | D5: 394 | E5: 506 | F5: =C5/B5 -> 0.30374620317245998 | G5: =H5+I5 -> 563 | H5: 235 | I5: 328 | J5: =G5/B5 -> 0.19001012487343899 | K5: 524 | L5: 231 | M5: 293 | N5: =K5/B5 -> 0.17684778940263199 | O5: 152 | P5: 65 | Q5: 87 | R5: =O5/B5 -> 5.1299358758015501e-002 | S5: 9 | T5: 2 | U5: 7 | V5: =S5/B5 -> 3.0374620317245998e-003 | W5: =SUM(X5:Y5) -> 1 | Y5: 1
A6: 夏家河 | B6: 2623 | C6: =SUM(D6:E6) -> 861 | D6: 400 | E6: 461 | F6: =C6/B6 -> 0.32825009531071297 | G6: =H6+I6 -> 654 | H6: 306 | I6: 348 | J6: =G6/B6 -> 0.249332825009531 | K6: 409 | L6: 193 | M6: 216 | N6: =K6/B6 -> 0.15592832634388101 | O6: 146 | P6: 61 | Q6: 85 | R6: =O6/B6 -> 5.5661456347693497e-002 | S6: 15 | T6: 4 | U6: 11 | V6: =S6/B6 -> 5.7186427754479597e-003
A7: 羊圈子 | B7: 1349 | C7: =SUM(D7:E7) -> 467 | D7: 220 | E7: 247 | F7: =C7/B7 -> 0.34618235730170499 | G7: =H7+I7 -> 306 | H7: 141 | I7: 165 | J7: =G7/B7 -> 0.22683469236471501 | K7: 195 | L7: 99 | M7: 96 | N7: =K7/B7 -> 0.144551519644181 | O7: 51 | P7: 24 | Q7: 27 | R7: =O7/B7 -> 3.7805782060785803e-002 | S7: 4 | T7: 2 | U7: 2 | V7: =S7/B7 -> 2.9651593773165302e-003
A8: 棋盘子 | B8: 3346 | C8: =SUM(D8:E8) -> 998 | D8: 485 | E8: 513 | F8: =C8/B8 -> 0.29826658696951602 | G8: =H8+I8 -> 580 | H8: 286 | I8: 294 | J8: =G8/B8 -> 0.173341303048416 | K8: 377 | L8: 178 | M8: 199 | N8: =K8/B8 -> 0.11267184698146999 | O8: 106 | P8: 47 | Q8: 59 | R8: =O8/B8 -> 3.1679617453676e-002 | S8: 12 | T8: 4 | U8: 8 | V8: =S8/B8 -> 3.58637178720861e-003
A9: 鞍子山 | B9: 2022 | C9: =SUM(D9:E9) -> 727 | D9: 345 | E9: 382 | F9: =C9/B9 -> 0.35954500494559799 | G9: =H9+I9 -> 520 | H9: 243 | I9: 277 | J9: =G9/B9 -> 0.25717111770524198 | K9: 320 | L9: 146 | M9: 174 | N9: =K9/B9 -> 0.158259149357072 | O9: 93 | P9: 38 | Q9: 55 | R9: =O9/B9 -> 4.5994065281899102e-002 | S9: 17 | T9: 2 | U9: 15 | V9: =S9/B9 -> 8.4075173095944592e-003
A10: 合计 | B10: =SUM(B4:B9) -> 16423 | C10: =SUM(C4:C9) -> 5230 | D10: =SUM(D4:D9) -> 2446 | E10: =SUM(E4:E9) -> 2784 | F10: =C10/B10 -> 0.31845582414905899 | G10: =SUM(G4:G9) -> 3477 | H10: =SUM(H4:H9) -> 1617 | I10: =SUM(I4:I9) -> 1860 | J10: =G10/B10 -> 0.21171527735492901 | K10: =SUM(K4:K9) -> 2314 | L10: =SUM(L4:L9) -> 1074 | M10: =SUM(M4:M9) -> 1240 | N10: =K10/B10 -> 0.14089995737684999 | O10: =SUM(O4:O9) -> 670 | P10: =SUM(P4:P9) -> 298 | Q10: =SUM(Q4:Q9) -> 372 | R10: =O10/B10 -> 4.07964440114474e-002 | S10: =SUM(S4:S9) -> 69 | T10: =SUM(T4:T9) -> 18 | U10: =SUM(U4:U9) -> 51 | V10: =S10/B10 -> 4.2014248310296501e-003 | W10: =SUM(W4:W9) -> 2 | X10: =SUM(X4:X9) -> 0 | Y10: =SUM(Y4:Y9) -> 2